schedule_id,asset_type,defect_type,severity,repair_method,preferred_window_type,preferred_crew_type,preferred_closure_type,planned_duration_hours,actual_duration_hours,context_conditions,schedule_outcome,disruption_outcome,lessons_learned,rag_text
SCHED-BRIDGE-001,bridge,spalling,high,partial-depth concrete patch,overnight,concrete,single-lane closure,8,7,"clear weather; low overnight traffic; no event conflict",successful,low disruption,"Concrete patching worked best in an overnight single-lane closure with concrete crew availability confirmed.","A bridge spalling repair using partial-depth concrete patch was scheduled overnight with a concrete repair crew and single-lane closure. Clear weather, low traffic, and no event conflict kept disruption low. The case recommends confirming concrete crew availability and selecting an overnight single-lane closure for similar bridge patching work."
SCHED-BRIDGE-002,bridge,exposed_rebar,high,rebar cleaning and concrete restoration,overnight,concrete,short full closure,12,14,"cold weather; access lift required; downtown event nearby",delayed,medium disruption,"Full closure coordination and lift staging should be confirmed before selecting the window.","A high-severity exposed rebar bridge repair needed concrete restoration, lift staging, and short full closure coordination. A nearby event and access setup increased disruption and caused delay. Similar repairs should prefer overnight windows only when closure coordination and access equipment are confirmed."
SCHED-BRIDGE-003,bridge,corrosion,moderate,abrasive cleaning and protective coating,overnight,steel,short full closure,10,11,"dry weather; moderate traffic; no event conflict",successful,medium disruption,"Steel coating work needs dry conditions and containment setup; avoid rain-risk windows.","A bridge corrosion coating repair was scheduled overnight with a steel coating crew and short full closure. Dry weather and no event conflict made the schedule successful. Similar coating work should prioritize dry weather, steel crew availability, and containment setup time."
SCHED-BRIDGE-004,bridge,crack,moderate,routing and sealing,overnight,joint,single-lane closure,6,6,"clear weather; low traffic; no event conflict",successful,low disruption,"Joint or crack sealing fit well in a single overnight lane closure.","A bridge crack routing and sealing repair was scheduled overnight with a joint repair crew and single-lane closure. Clear weather and low traffic produced low disruption. Similar crack sealing work should prefer overnight windows with joint crew availability."
SCHED-ROAD-001,road,crack,moderate,epoxy injection and surface sealing,overnight,joint,single-lane closure,9,9,"clear weather; low traffic; utility work nearby",successful with monitoring,medium disruption,"Nearby utility work should be checked before finalizing lane closures.","A road crack repair using epoxy injection and surface sealing was scheduled overnight with a joint crew and single-lane closure. Nearby utility work created moderate disruption. Similar repairs should check city work conflicts before selecting the window."
